{
  "id": "01KCCCCCCCCCCCCCCCCCCCCCCC",
  "sala_id": "01KDDDDDDDDDDDDDDDDDDDDDDD",
  "testador_id": "01KEEEEEEEEEEEEEEEEEEEEEEE",
  "documento_id": "01KAAAAAAAAAAAAAAAAAAAAAAA",
  "versao_id": "01KFFFFFFFFFFFFFFFFFFFFFFF",
  "bloco_id": "01KGGGGGGGGGGGGGGGGGGGGGGG",
  "inicio_utf16": 4,
  "fim_utf16": 7,
  "citacao": "razão 🧭 é",
  "texto": "Não entendi esta nota.",
  "criado_em": "2026-10-02T12:00:00.000Z"
}
